[
  {
    "patient_id": "P85822413",
    "demographics": {
      "age": 32,
      "gender": "male",
      "race_ethnicity": "Hispanic or Latino",
      "zip_code": "46048"
    },
    "health_metrics": {
      "vital_signs": {
        "systolic_bp": 153,
        "diastolic_bp": 88,
        "heart_rate": 94,
        "temperature": 97.7,
        "weight": 228,
        "height": 61
      },
      "bmi": 43.1
    },
    "diagnoses": [
      {
        "code": "I10",
        "description": "Essential (primary) hypertension",
        "status": "chronic",
        "onset_date": "2021-02-16"
      }
    ],
    "medications": [
      {
        "name": "Lisinopril",
        "dosage": "10mg once daily",
        "start_date": "2023-02-20"
      }
    ],
    "allergies": [
      {
        "allergen": "Peanuts",
        "severity": "severe",
        "reaction": "Anaphylaxis"
      }
    ],
    "lab_results": [
      {
        "test_name": "HDL Cholesterol",
        "value": 47.6,
        "unit": "mg/dL",
        "reference_range": ">40",
        "date": "2025-09-24T20:39:53Z",
        "abnormal_flag": false
      },
      {
        "test_name": "Glucose, fasting",
        "value": 79.9,
        "unit": "mg/dL",
        "reference_range": "70-100",
        "date": "2025-12-08T20:39:53Z",
        "abnormal_flag": false
      },
      {
        "test_name": "Hemoglobin A1C",
        "value": 5.0,
        "unit": "%",
        "reference_range": "4.0-5.6",
        "date": "2025-11-03T20:39:53Z",
        "abnormal_flag": false
      },
      {
        "test_name": "Total Cholesterol",
        "value": 168.2,
        "unit": "mg/dL",
        "reference_range": "125-200",
        "date": "2025-10-26T20:39:53Z",
        "abnormal_flag": true
      }
    ],
    "last_updated": "2025-12-09T20:39:53Z"
  },
  {
    "patient_id": "P13718432",
    "demographics": {
      "age": 29,
      "gender": "unknown",
      "race_ethnicity": "White",
      "zip_code": "57052"
    },
    "health_metrics": {
      "vital_signs": {
        "systolic_bp": 124,
        "diastolic_bp": 73,
        "heart_rate": 84,
        "temperature": 97.7,
        "weight": 195,
        "height": 71
      },
      "bmi": 27.2
    },
    "diagnoses": [
      {
        "code": "M79.3",
        "description": "Panniculitis, unspecified",
        "status": "active",
        "onset_date": "2022-07-09"
      },
      {
        "code": "E78.5",
        "description": "Hyperlipidemia, unspecified",
        "status": "chronic",
        "onset_date": "2020-12-14"
      }
    ],
    "medications": [
      {
        "name": "Atorvastatin",
        "dosage": "20mg once daily",
        "start_date": "2023-03-10"
      }
    ],
    "allergies": [],
    "lab_results": [
      {
        "test_name": "Glucose, fasting",
        "value": 109.6,
        "unit": "mg/dL",
        "reference_range": "70-100",
        "date": "2025-10-21T20:39:53Z",
        "abnormal_flag": false
      },
      {
        "test_name": "Triglycerides",
        "value": 114.5,
        "unit": "mg/dL",
        "reference_range": "<150",
        "date": "2025-09-18T20:39:53Z",
        "abnormal_flag": false
      },
      {
        "test_name": "Hemoglobin A1C",
        "value": 5.2,
        "unit": "%",
        "reference_range": "4.0-5.6",
        "date": "2025-09-14T20:39:53Z",
        "abnormal_flag": false
      },
      {
        "test_name": "LDL Cholesterol",
        "value": 82.3,
        "unit": "mg/dL",
        "reference_range": "<100",
        "date": "2025-09-12T20:39:53Z",
        "abnormal_flag": false
      }
    ],
    "last_updated": "2025-12-09T20:39:53Z"
  },
  {
    "patient_id": "P86977838",
    "demographics": {
      "age": 27,
      "gender": "female",
      "race_ethnicity": "American Indian or Alaska Native",
      "zip_code": "42087"
    },
    "health_metrics": {
      "vital_signs": {
        "systolic_bp": 118,
        "diastolic_bp": 77,
        "heart_rate": 80,
        "temperature": 99.2,
        "weight": 134,
        "height": 67
      },
      "bmi": 21.0
    },
    "diagnoses": [
      {
        "code": "J45.909",
        "description": "Unspecified asthma, uncomplicated",
        "status": "active",
        "onset_date": "2023-07-12"
      }
    ],
    "medications": [],
    "allergies": [],
    "lab_results": [
      {
        "test_name": "LDL Cholesterol",
        "value": 98.7,
        "unit": "mg/dL",
        "reference_range": "<100",
        "date": "2025-10-29T20:39:53Z",
        "abnormal_flag": false
      },
      {
        "test_name": "Total Cholesterol",
        "value": 226.4,
        "unit": "mg/dL",
        "reference_range": "125-200",
        "date": "2025-10-06T20:39:53Z",
        "abnormal_flag": false
      },
      {
        "test_name": "Glucose, fasting",
        "value": 72.4,
        "unit": "mg/dL",
        "reference_range": "70-100",
        "date": "2025-11-05T20:39:53Z",
        "abnormal_flag": false
      }
    ],
    "last_updated": "2025-12-09T20:39:53Z"
  },
  {
    "patient_id": "P18740865",
    "demographics": {
      "age": 49,
      "gender": "other",
      "race_ethnicity": "Hispanic or Latino",
      "zip_code": "86622"
    },
    "health_metrics": {
      "vital_signs": {
        "systolic_bp": 125,
        "diastolic_bp": 72,
        "heart_rate": 63,
        "temperature": 99.2,
        "weight": 159,
        "height": 65
      },
      "bmi": 26.5
    },
    "diagnoses": [
      {
        "code": "M79.3",
        "description": "Panniculitis, unspecified",
        "status": "active",
        "onset_date": "2022-07-09"
      },
      {
        "code": "J45.909",
        "description": "Unspecified asthma, uncomplicated",
        "status": "active",
        "onset_date": "2023-07-12"
      },
      {
        "code": "E78.5",
        "description": "Hyperlipidemia, unspecified",
        "status": "chronic",
        "onset_date": "2020-12-14"
      }
    ],
    "medications": [
      {
        "name": "Atorvastatin",
        "dosage": "20mg once daily",
        "start_date": "2023-03-10"
      }
    ],
    "allergies": [],
    "lab_results": [
      {
        "test_name": "HDL Cholesterol",
        "value": 68.5,
        "unit": "mg/dL",
        "reference_range": ">40",
        "date": "2025-10-10T20:39:53Z",
        "abnormal_flag": false
      },
      {
        "test_name": "Glucose, fasting",
        "value": 63.8,
        "unit": "mg/dL",
        "reference_range": "70-100",
        "date": "2025-12-07T20:39:53Z",
        "abnormal_flag": false
      },
      {
        "test_name": "LDL Cholesterol",
        "value": 82.7,
        "unit": "mg/dL",
        "reference_range": "<100",
        "date": "2025-11-24T20:39:53Z",
        "abnormal_flag": false
      }
    ],
    "last_updated": "2025-12-09T20:39:53Z"
  },
  {
    "patient_id": "P91497617",
    "demographics": {
      "age": 52,
      "gender": "other",
      "race_ethnicity": "White",
      "zip_code": "48469"
    },
    "health_metrics": {
      "vital_signs": {
        "systolic_bp": 138,
        "diastolic_bp": 90,
        "heart_rate": 92,
        "temperature": 99.3,
        "weight": 196,
        "height": 66
      },
      "bmi": 31.6
    },
    "diagnoses": [
      {
        "code": "I10",
        "description": "Essential (primary) hypertension",
        "status": "chronic",
        "onset_date": "2021-02-16"
      },
      {
        "code": "J45.909",
        "description": "Unspecified asthma, uncomplicated",
        "status": "active",
        "onset_date": "2023-07-12"
      },
      {
        "code": "E11.9",
        "description": "Type 2 diabetes mellitus without complications",
        "status": "chronic",
        "onset_date": "2022-11-11"
      }
    ],
    "medications": [
      {
        "name": "Metformin",
        "dosage": "500mg twice daily",
        "start_date": "2023-01-15"
      },
      {
        "name": "Lisinopril",
        "dosage": "10mg once daily",
        "start_date": "2023-02-20"
      }
    ],
    "allergies": [
      {
        "allergen": "Penicillin",
        "severity": "moderate",
        "reaction": "Rash"
      }
    ],
    "lab_results": [
      {
        "test_name": "Total Cholesterol",
        "value": 217.1,
        "unit": "mg/dL",
        "reference_range": "125-200",
        "date": "2025-10-30T20:39:53Z",
        "abnormal_flag": false
      },
      {
        "test_name": "LDL Cholesterol",
        "value": 76.7,
        "unit": "mg/dL",
        "reference_range": "<100",
        "date": "2025-11-08T20:39:53Z",
        "abnormal_flag": false
      },
      {
        "test_name": "Glucose, fasting",
        "value": 107.5,
        "unit": "mg/dL",
        "reference_range": "70-100",
        "date": "2025-10-07T20:39:53Z",
        "abnormal_flag": true
      },
      {
        "test_name": "HDL Cholesterol",
        "value": 38.2,
        "unit": "mg/dL",
        "reference_range": ">40",
        "date": "2025-10-01T20:39:53Z",
        "abnormal_flag": false
      }
    ],
    "last_updated": "2025-12-09T20:39:53Z"
  },
  {
    "patient_id": "P16879291",
    "demographics": {
      "age": 34,
      "gender": "unknown",
      "race_ethnicity": "American Indian or Alaska Native",
      "zip_code": "31643"
    },
    "health_metrics": {
      "vital_signs": {
        "systolic_bp": 127,
        "diastolic_bp": 76,
        "heart_rate": 79,
        "temperature": 98.3,
        "weight": 215,
        "height": 74
      },
      "bmi": 27.6
    },
    "diagnoses": [
      {
        "code": "M79.3",
        "description": "Panniculitis, unspecified",
        "status": "active",
        "onset_date": "2022-07-09"
      },
      {
        "code": "E66.9",
        "description": "Obesity, unspecified",
        "status": "chronic",
        "onset_date": "2021-05-25"
      }
    ],
    "medications": [],
    "allergies": [],
    "lab_results": [
      {
        "test_name": "Glucose, fasting",
        "value": 91.9,